{
  "$schema": "ds-fleet/policy.v1",
  "tokenOverrides": { "semanticTier": "allowlist", "allowlist": ["color.surface.raised", "color.accent.default"] },
  "minEvalCritical": 1.0,
  "minFirstPass": 0.8,
  "requiredGauntletSteps": ["typecheck", "lint", "build", "test", "registry-check"],
  "browserAxe": "required",
  "maxFabrications": 0
}
